{
  "$schema": "../schema/app-menu.json",
  "back": "返回首頁",
  "edit.copy": "複製",
  "edit.delete": "刪除",
  "edit.duplicate": "快速拷貝",
  "edit.history.redo": "重做",
  "edit.history.undo": "復原",
  "edit.new.board": "新增木板",
  "edit.new.component": "新增物件組合",
  "edit.new.cut": "新增裁切",
  "edit.paste": "貼上",
  "edit.transform.disable": "停用變換模式",
  "edit.transform.enable": "啟用變換模式",
  "edit.visibility.all.hide": "隱藏全部",
  "edit.visibility.all.show": "顯示全部",
  "edit.visibility.hide": "隱藏",
  "edit.visibility.show": "顯示",
  "edit": "編輯",
  "file.export.gtlf": "GLTF",
  "file.export.obj": "OBJ",
  "file.export.ply": "PLY",
  "file.export.stl": "STL",
  "file.export.png": "PNG",
  "file.export.xslx": "XSLX",
  "file.export": "匯出",
  "file.new": "新建專案",
  "file.open": "開啟專案",
  "file.save": "儲存",
  "file": "檔案",
  "mode.dark": "切換至深色模式",
  "mode.light": "切換至淺色模式",
  "selection.find": "尋找",
  "selection.next": "下一個",
  "selection.previous": "上一個",
  "selection.select.all": "全選",
  "selection.select.none": "取消選擇",
  "selection": "選擇",
  "view.active.dimension": "尺寸面板",
  "view.active.disable": "隱藏面板",
  "view.active.enable": "顯示面板",
  "view.active.info": "資訊面板",
  "view.active.position": "位置面板",
  "view.active.rotation": "旋轉面板",
  "view.active": "作用面板",
  "view.camera.orthographic": "相機 (正交)",
  "view.camera.perspective": "相機 (透視)",
  "view.drawer.disable": "隱藏抽屜",
  "view.drawer.enable": "顯示抽屜",
  "view.focused.disable": "停用焦點模式",
  "view.focused.disabled": "焦點模式停用",
  "view.focused.enable": "啟用焦點模式",
  "view.focused.enabled": "焦點模式啟用",
  "view.grid.axis.none": "無",
  "view.grid.axis.primary.imperial": "英尺",
  "view.grid.axis.primary.metric": "公尺",
  "view.grid.axis.secondary.imperial": "英吋",
  "view.grid.axis.secondary.metric": "公分",
  "view.grid.axis.tertiary.imperial": "八分之一英吋",
  "view.grid.axis.tertiary.metric": "毫米",
  "view.grid.disable": "隱藏網格",
  "view.grid.disabled": "網格 (停用)",
  "view.grid.enable": "顯示網格",
  "view.grid.enabled": "網格 (啟用)",
  "view.grid.x": "X 網格",
  "view.grid.y": "Y 網格",
  "view.grid.z": "Z 網格",
  "view.ruler.disable": "隱藏尺規",
  "view.ruler.disabled": "尺規 (停用)",
  "view.ruler.enable": "顯示尺規",
  "view.ruler.enabled": "尺規 (啟用)",
  "view.ruler.snap.disable": "停用捕捉",
  "view.ruler.snap.enable": "啟用捕捉",
  "view.ruler.point.a": "設定點 A",
  "view.ruler.point.b": "設定點 B",
  "view.ruler.point.clear": "清除點",
  "view": "檢視"
}
