{
  "$schema": "../schema/app-menu.json",
  "back": "Back to Site",
  "edit.copy": "Copy",
  "edit.delete": "Delete",
  "edit.duplicate": "Duplicate",
  "edit.history.redo": "Redo",
  "edit.history.undo": "Undo",
  "edit.new.board": "New Board",
  "edit.new.component": "New Component",
  "edit.new.cut": "New Cut",
  "edit.paste": "Paste",
  "edit.transform.disable": "Disable Transform Mode",
  "edit.transform.enable": "Enable Transform Mode",
  "edit.visibility.all.hide": "Hide All",
  "edit.visibility.all.show": "Show All",
  "edit.visibility.hide": "Hide",
  "edit.visibility.show": "Show",
  "edit": "Edit",
  "file.export.gtlf": "GL Transmission Format (GLTF)",
  "file.export.obj": "Wavefront (OBJ)",
  "file.export.ply": "Polygon (PLY)",
  "file.export.stl": "StereoLithography (STL)",
  "file.export.png": "Screenshot (PNG)",
  "file.export.xslx": "Cutlist (XLSX)",
  "file.export": "Export",
  "file.new": "New",
  "file.open": "Open",
  "file.save": "Save",
  "file": "File",
  "mode.dark": "Switch to Dark Mode",
  "mode.light": "Switch to Light Mode",
  "selection.find": "Find",
  "selection.next": "Next",
  "selection.previous": "Previous",
  "selection.select.all": "Select All",
  "selection.select.none": "Select None",
  "selection": "Selection",
  "view.active.dimension": "Dimension Panel",
  "view.active.disable": "Hide Panel",
  "view.active.enable": "Show Panel",
  "view.active.info": "Info Panel",
  "view.active.position": "Position Panel",
  "view.active.rotation": "Rotation Panel",
  "view.active": "Active Panel",
  "view.camera.orthographic": "Camera (Orthographic)",
  "view.camera.perspective": "Camera (Perspective)",
  "view.drawer.disable": "Hide Drawer",
  "view.drawer.enable": "Show Drawer",
  "view.focused.disable": "Disable Focused Mode",
  "view.focused.disabled": "Focused Mode Disabled",
  "view.focused.enable": "Enable Focused Mode",
  "view.focused.enabled": "Focused Mode Enabled",
  "view.grid.axis.none": "None",
  "view.grid.axis.primary.imperial": "Feet",
  "view.grid.axis.primary.metric": "Meters",
  "view.grid.axis.secondary.imperial": "Inches",
  "view.grid.axis.secondary.metric": "Centimeters",
  "view.grid.axis.tertiary.imperial": "Eighths",
  "view.grid.axis.tertiary.metric": "Millimeters",
  "view.grid.disable": "Hide Grid",
  "view.grid.disabled": "Grid (Disabled)",
  "view.grid.enable": "Show Grid",
  "view.grid.enabled": "Grid (Enabled)",
  "view.grid.x": "X Grid",
  "view.grid.y": "Y Grid",
  "view.grid.z": "Z Grid",
  "view.ruler.disable": "Hide Ruler",
  "view.ruler.disabled": "Ruler (Disabled)",
  "view.ruler.enable": "Show Ruler",
  "view.ruler.enabled": "Ruler (Enabled)",
  "view.ruler.snap.disable": "Disable Snap",
  "view.ruler.snap.enable": "Enable Snap",
  "view.ruler.point.a": "Set Point A",
  "view.ruler.point.b": "Set Point B",
  "view.ruler.point.clear": "Clear Points",
  "view": "View"
}
